{
  "artifact_sha256": "3333333333333333333333333333333333333333333333333333333333333333",
  "build_commit": "0000000000000000000000000000000000000000",
  "config_bundle_sha256": "2222222222222222222222222222222222222222222222222222222222222222",
  "contract_manifest_sha256": "1111111111111111111111111111111111111111111111111111111111111111",
  "emitted_at_us": 1786156800123456,
  "event_id": "evt_triad_edge_candidate_v2",
  "event_kind": "EDGE_CANDIDATE",
  "payload": {
    "arm": "CONTROL",
    "cancellation_conditions": [],
    "candidate_id": "x",
    "canonical_instrument_id": "x",
    "capsule_id": "x",
    "capsule_version": "x",
    "cost_model_id": "x",
    "direction": "LONG",
    "entry_policy": "x",
    "entry_reference_ticks": "0",
    "fill_model_id": "x",
    "horizon": "1",
    "hypothesis_id": "x",
    "natural_invalidation_ticks": "0",
    "not_before_us": 1786156800123456,
    "opportunity_cluster_id": "x",
    "parameter_digest": "0000000000000000000000000000000000000000000000000000000000000000",
    "prerequisites": [],
    "provenance_hash": "0000000000000000000000000000000000000000000000000000000000000000",
    "quality": {},
    "rr_denominator": "1",
    "rr_numerator": "1",
    "source_reaction_id": "x",
    "source_structure_id": "x",
    "targets": [],
    "trial_id": "x",
    "ttl_us": 1786156800123456
  },
  "producer_epoch": "42",
  "producer_instance_id": "inst_golden_01",
  "producer_service": "origin",
  "schema": "triad.edge_candidate.v2",
  "schema_version": "2.0.0"
}
